email_text,category,urgency
Summers finally here! Fancy a chat or flirt with sexy singles in yr area? To get MATCHED up just reply SUMMER now. Free 2 Join. OptOut txt STOP Help08714742804,spam,low
"This is the 2nd time we have tried 2 contact u. U have won the 750 Pound prize. 2 claim is easy, call 08718726970 NOW! Only 10p per min. BT-national-rate ",spam,low
Get ur 1st RINGTONE FREE NOW! Reply to this msg with TONE. Gr8 TOP 20 tones to your phone every week just £1.50 per wk 2 opt out send STOP 08452810071 16,spam,low
Ur cash-balance is currently 500 pounds - to maximize ur cash-in now send GO to 86688 only 150p/msg. CC: 08718720201 PO BOX 114/14 TCR/W1,spam,low
"Last Chance! Claim ur £150 worth of discount vouchers today! Text SHOP to 85023 now! SavaMob, offers mobile! T Cs SavaMob POBOX84, M263UZ. £3.00 Sub. 16",spam,low
"You can stop further club tones by replying ""STOP MIX"" See my-tone.com/enjoy. html for terms. Club tones cost GBP4.50/week. MFL, PO Box 1146 MK45 2WT (2/3)",spam,low
"For ur chance to win a £250 cash every wk TXT: ACTION to 80608. T's&C's www.movietrivia.tv custcare 08712405022, 1x150p/wk",spam,low
WIN a year supply of CDs 4 a store of ur choice worth £500 & enter our £100 Weekly draw txt MUSIC to 87066 Ts&Cs www.Ldew.com.subs16+1win150ppmx3,spam,low
YOU HAVE WON! As a valued Vodafone customer our computer has picked YOU to win a £150 prize. To collect is easy. Just call 09061743386,spam,low
sports fans - get the latest sports news str* 2 ur mobile 1 wk FREE PLUS a FREE TONE Txt SPORT ON to 8007 www.getzed.co.uk 0870141701216+ norm 4txt/120p ,spam,low
You have WON a guaranteed £1000 cash or a £2000 prize.To claim yr prize call our customer service representative on,spam,low
"Urgent Urgent! We have 800 FREE flights to Europe to give away, call B4 10th Sept & take a friend 4 FREE. Call now to claim on 09050000555. BA128NNFWFLY150ppm",spam,low
"Free Msg: get Gnarls Barkleys ""Crazy"" ringtone TOTALLY FREE just reply GO to this message right now!",spam,low
"pdate_Now - Double mins and 1000 txts on Orange tariffs. Latest Motorola, SonyEricsson & Nokia & Bluetooth FREE! Call MobileUpd8 on 08000839402 or call2optout/!YHL",spam,low
Your next amazing xxx PICSFREE1 video will be sent to you enjoy! If one vid is not enough for 2day text back the keyword PICSFREE1 to get the next video.,spam,low
You will recieve your tone within the next 24hrs. For Terms and conditions please see Channel U Teletext Pg 750,spam,low
"Congrats! 2 mobile 3G Videophones R yours. call 09061744553 now! videochat wid ur mates, play java games, Dload polyH music, noline rentl. bx420. ip4. 5we. 150pm",spam,low
Free entry in 2 a weekly comp for a chance to win an ipod. Txt POD to 80182 to get entry (std txt rate) T&C's apply 08452810073 for details 18+,spam,low
I don't know u and u don't know me. Send CHAT to 86688 now and let's find each other! Only 150p/Msg rcvd. HG/Suite342/2Lands/Row/W1J6HL LDN. 18 years or over.,spam,low
ASKED 3MOBILE IF 0870 CHATLINES INCLU IN FREE MINS. INDIA CUST SERVs SED YES. L8ER GOT MEGA BILL. 3 DONT GIV A SHIT. BAILIFF DUE IN DAYS. I O £250 3 WANT £800,spam,low
Hey I am really horny want to chat or see me naked text hot to 69698 text charged at 150pm to unsubscribe text stop 69698,spam,low
"Mila, age23, blonde, new in UK. I look sex with UK guys. if u like fun with me. Text MTALK to 69866.18 . 30pp/txt 1st 5free. £1.50 increments. Help08718728876",spam,low
"Urgent! Please call 09066612661 from your landline, your complimentary 4* Lux Costa Del Sol holiday or £1000 CASH await collection. ppm 150 SAE T&Cs James 28, EH74RR",spam,low
Great News! Call FREEFONE 08006344447 to claim your guaranteed £1000 CASH or £2000 gift. Speak to a live operator NOW!,spam,low
PRIVATE! Your 2003 Account Statement for shows 800 un-redeemed S. I. M. points. Call 08715203652 Identifier Code: 42810 Expires 29/10/0,spam,low
"Sunshine Hols. To claim ur med holiday send a stamped self address envelope to Drinks on Us UK, PO Box 113, Bray, Wicklow, Eire. Quiz Starts Saturday! Unsub Stop",spam,low
Enjoy the jamster videosound gold club with your credits for 2 new videosounds+2 logos+musicnews! get more fun from jamster.co.uk! 16+only Help? call: 09701213186 ,spam,low
"U've been selected to stay in 1 of 250 top British hotels - FOR NOTHING! Holiday valued at £350! Dial 08712300220 to claim - National Rate Call. Bx526, SW73SS",spam,low
You are being ripped off! Get your mobile content from www.clubmoby.com call 08717509990 poly/true/Pix/Ringtones/Games six downloads for only 3,spam,low
"Eerie Nokia tones 4u, rply TONE TITLE to 8007 eg TONE DRACULA to 8007 Titles: GHOST, ADDAMSFA, MUNSTERS, EXORCIST, TWILIGHT www.getzed.co.uk POBox36504W45WQ 150p",spam,low
Your B4U voucher w/c 27/03 is MARSMS. Log onto www.B4Utele.com for discount credit. To opt out reply stop. Customer care call 08717168528,spam,low
"Hi babe its Jordan, how r u? Im home from abroad and lonely, text me back if u wanna chat xxSP visionsms.com Text stop to stopCost 150p 08712400603",spam,low
FREE entry into our £250 weekly comp just send the word WIN to 80086 NOW. 18 T&C www.txttowin.co.uk,spam,low
Hi 07734396839 IBH Customer Loyalty Offer: The NEW NOKIA6600 Mobile from ONLY £10 at TXTAUCTION!Txt word:START to No:81151 & get Yours Now!4T&,spam,low
"Today's Offer! Claim ur £150 worth of discount vouchers! Text YES to 85023 now! SavaMob, member offers mobile! T Cs 08717898035. £3.00 Sub. 16 . Unsub reply X",spam,low
"You have won ?1,000 cash or a ?2,000 prize! To claim, call09050000327",spam,low
"Orange brings you ringtones from all time Chart Heroes, with a free hit each week! Go to Ringtones & Pics on wap. To stop receiving these tips reply STOP.",spam,low
<Forwarded from 88877>FREE entry into our £250 weekly comp just send the word ENTER to 88877 NOW. 18 T&C www.textcomp.com,spam,low
"Congratulations! Thanks to a good friend U have WON the £2,000 Xmas prize. 2 claim is easy, just call 08718726971 NOW! Only 10p per minute. BT-national-rate.",spam,low
Not heard from U4 a while. Call 4 rude chat private line 01223585334 to cum. Wan 2C pics of me gettin shagged then text PIX to 8552. 2End send STOP 8552 SAM xxx,spam,low
"500 New Mobiles from 2004, MUST GO! Txt: NOKIA to No: 89545 & collect yours today!From ONLY £1 www.4-tc.biz 2optout 087187262701.50gbp/mtmsg18",spam,low
URGENT! Your Mobile number has been awarded with a £2000 Bonus Caller Prize. Call 09058095201 from land line. Valid 12hrs only,spam,low
"HOT LIVE FANTASIES call now 08707500020 Just 20p per min NTT Ltd, PO Box 1327 Croydon CR9 5WB 0870 is a national rate call",spam,low
PRIVATE! Your 2003 Account Statement for 07815296484 shows 800 un-redeemed S.I.M. points. Call 08718738001 Identifier Code 41782 Expires 18/11/04 ,spam,low
Bloomberg -Message center +447797706009 Why wait? Apply for your future http://careers. bloomberg.com,spam,low
"UpgrdCentre Orange customer, you may now claim your FREE CAMERA PHONE upgrade for your loyalty. Call now on 0207 153 9153. Offer ends 26th July. T&C's apply. Opt-out available",spam,low
Send a logo 2 ur lover - 2 names joined by a heart. Txt LOVE NAME1 NAME2 MOBNO eg LOVE ADAM EVE 07123456789 to 87077 Yahoo! POBox36504W45WQ TxtNO 4 no ads 150p.,spam,low
"Congrats! 1 year special cinema pass for 2 is yours. call 09061209465 now! C Suprman V, Matrix3, StarWars3, etc all 4 FREE! bx420-ip4-5we. 150pm. Dont miss out!",spam,low
SMS. ac Sptv: The New Jersey Devils and the Detroit Red Wings play Ice Hockey. Correct or Incorrect? End? Reply END SPTV,spam,low
You have 1 new message. Call 0207-083-6089,spam,low
Do you want a New Nokia 3510i Colour Phone Delivered Tomorrow? With 200 FREE minutes to any mobile + 100 FREE text + FREE camcorder Reply or Call 08000930705,spam,low
Valentines Day Special! Win over £1000 in our quiz and take your partner on the trip of a lifetime! Send GO to 83600 now. 150p/msg rcvd. CustCare:08718720201,spam,low
Sorry! U can not unsubscribe yet. THE MOB offer package has a min term of 54 weeks> pls resubmit request after expiry. Reply THEMOB HELP 4 more info,spam,low
4mths half price Orange line rental & latest camera phones 4 FREE. Had your phone 11mths+? Call MobilesDirect free on 08000938767 to update now! or2stoptxt T&Cs,spam,low
Someone has conacted our dating service and entered your phone because they fancy you!To find out who it is call from landline 09111030116. PoBox12n146tf15,spam,low
SMS AUCTION - A BRAND NEW Nokia 7250 is up 4 auction today! Auction is FREE 2 join & take part! Txt NOKIA to 86021 now! HG/Suite342/2Lands Row/W1J6HL,spam,low
FREE for 1st week! No1 Nokia tone 4 ur mobile every week just txt NOKIA to 8077 Get txting and tell ur mates. www.getzed.co.uk POBox 36504 W45WQ 16+ norm150p/tone,spam,low
Here is your discount code RP176781. To stop further messages reply stop. www.regalportfolio.co.uk. Customer Services 08717205546,spam,low
18 days to Euro2004 kickoff! U will be kept informed of all the latest news and results daily. Unsubscribe send GET EURO STOP to 83222.,spam,low
"WELL DONE! Your 4* Costa Del Sol Holiday or £5000 await collection. Call 09050090044 Now toClaim. SAE, TCs, POBox334, Stockport, SK38xh, Cost£1.50/pm, Max10mins",spam,low
"URGENT! You have won a 1 week FREE membership in our £100,000 Prize Jackpot! Txt the word: CLAIM to No: 81010 T&C www.dbuk.net LCCLTD POBOX 4403LDNW1A7RW18",spam,low
todays vodafone numbers ending with 0089(my last four digits) are selected to received a £350 award. If your number matches please call 09063442151 to claim your £350 award,spam,low
"09066362231 URGENT! Your mobile No 07xxxxxxxxx won a £2,000 bonus caller prize on 02/06/03! this is the 2nd attempt to reach YOU! call 09066362231 ASAP!",spam,low
XMAS iscoming & ur awarded either £500 CD gift vouchers & free entry 2 r £100 weekly draw txt MUSIC to 87066 TnC www.Ldew.com1win150ppmx3age16subscription ,spam,low
"As a valued customer, I am pleased to advise you that following recent review of your Mob No. you are awarded with a £1500 Bonus Prize, call 09066364589",spam,low
"Loan for any purpose £500 - £75,000. Homeowners + Tenants welcome. Have you been previously refused? We can still help. Call Free 0800 1956669 or text back 'help'",spam,low
This is the 2nd time we have tried to contact u. U have won the £1450 prize to claim just call 09053750005 b4 310303. T&Cs/stop SMS 08718725756. 140ppm,spam,low
Great News! Call FREEFONE 08006344447 to claim your guaranteed £1000 CASH or £2000 gift. Speak to a live operator NOW!,spam,low
"LookAtMe!: Thanks for your purchase of a video clip from LookAtMe!, you've been charged 35p. Think you can do better? Why not send a video in a MMSto 32323.",spam,low
Promotion Number: 8714714 - UR awarded a City Break and could WIN a £200 Summer Shopping spree every WK. Txt STORE to 88039 . SkilGme. TsCs087147403231Winawk!Age16 £1.50perWKsub,spam,low
Get your garden ready for summer with a FREE selection of summer bulbs and seeds worth £33:50 only with The Scotsman this Saturday. To stop go2 notxt.co.uk,spam,low
"REMINDER FROM O2: To get 2.50 pounds free call credit and details of great offers pls reply 2 this text with your valid name, house no and postcode",spam,low
"SMS. ac JSco: Energy is high, but u may not know where 2channel it. 2day ur leadership skills r strong. Psychic? Reply ANS w/question. End? Reply END JSCO",spam,low
I don't know u and u don't know me. Send CHAT to 86688 now and let's find each other! Only 150p/Msg rcvd. HG/Suite342/2Lands/Row/W1J6HL LDN. 18 years or over.,spam,low
Sunshine Quiz! Win a super Sony DVD recorder if you canname the capital of Australia? Text MQUIZ to 82277. B,spam,low
"You are guaranteed the latest Nokia Phone, a 40GB iPod MP3 player or a £500 prize! Txt word: COLLECT to No: 83355! IBHltd LdnW15H 150p/Mtmsgrcvd18+",spam,low
Bought one ringtone and now getting texts costing 3 pound offering more tones etc,spam,low
"ou are guaranteed the latest Nokia Phone, a 40GB iPod MP3 player or a £500 prize! Txt word: COLLECT to No: 83355! IBHltd LdnW15H 150p/Mtmsgrcvd18",spam,low
Get a brand new mobile phone by being an agent of The Mob! Plus loads more goodies! For more info just text MAT to 87021.,spam,low
URGENT! Your Mobile number has been awarded with a £2000 prize GUARANTEED. Call 09058094455 from land line. Claim 3030. Valid 12hrs only,spam,low
Your weekly Cool-Mob tones are ready to download !This weeks new Tones include: 1) Crazy Frog-AXEL F>>> 2) Akon-Lonely>>> 3) Black Eyed-Dont P >>>More info in n,spam,low
"Hello darling how are you today? I would love to have a chat, why dont you tell me what you look like and what you are in to sexy?",spam,low
Valentines Day Special! Win over £1000 in our quiz and take your partner on the trip of a lifetime! Send GO to 83600 now. 150p/msg rcvd. CustCare:08718720201.,spam,low
This message is brought to you by GMW Ltd. and is not connected to the,spam,low
Guess what! Somebody you know secretly fancies you! Wanna find out who it is? Give us a call on 09065394514 From Landline DATEBox1282EssexCM61XN 150p/min 18,spam,low
Get your garden ready for summer with a FREE selection of summer bulbs and seeds worth £33:50 only with The Scotsman this Saturday. To stop go2 notxt.co.uk,spam,low
Want explicit SEX in 30 secs? Ring 02073162414 now! Costs 20p/min,spam,low
XMAS Prize draws! We are trying to contact U. Todays draw shows that you have won a £2000 prize GUARANTEED. Call 09058094565 from land line. Valid 12hrs only,spam,low
From next month get upto 50% More Calls 4 Ur standard network charge 2 activate Call 9061100010 C Wire3.net 1st4Terms PoBox84 M26 3UZ Cost £1.50 min MobcudB more,spam,low
Want 2 get laid tonight? Want real Dogging locations sent direct 2 ur mob? Join the UK's largest Dogging Network bt Txting GRAVEL to 69888! Nt. ec2a. 31p.msg@150p,spam,low
Dear 0776xxxxxxx U've been invited to XCHAT. This is our final attempt to contact u! Txt CHAT to 86688 150p/MsgrcvdHG/Suite342/2Lands/Row/W1J6HL LDN 18yrs ,spam,low
Want explicit SEX in 30 secs? Ring 02073162414 now! Costs 20p/min Gsex POBOX 2667 WC1N 3XX,spam,low
"Urgent UR awarded a complimentary trip to EuroDisinc Trav, Aco&Entry41 Or £1000. To claim txt DIS to 87121 18+6*£1.50(moreFrmMob. ShrAcomOrSglSuplt)10, LS1 3AJ",spam,low
WIN URGENT! Your mobile number has been awarded with a £2000 prize GUARANTEED call 09061790121 from land line. claim 3030 valid 12hrs only 150ppm ,spam,low
Our brand new mobile music service is now live. The free music player will arrive shortly. Just install on your phone to browse content from the top artists.,spam,low
Call Germany for only 1 pence per minute! Call from a fixed line via access number 0844 861 85 85. No prepayment. Direct access! www.telediscount.co.uk,spam,low
You have an important customer service announcement from PREMIER.,spam,low
PRIVATE! Your 2003 Account Statement for 07753741225 shows 800 un-redeemed S. I. M. points. Call 08715203677 Identifier Code: 42478 Expires 24/10/04,spam,low
it to 80488. Your 500 free text messages are valid until 31 December 2005.,spam,low
WINNER!! As a valued network customer you have been selected to receivea £900 prize reward! To claim call 09061701461. Claim code KL341. Valid 12 hours only.,spam,low
Natalja (25/F) is inviting you to be her friend. Reply YES-440 or NO-440 See her: www.SMS.ac/u/nat27081980 STOP? Send STOP FRND to 62468,spam,low
PRIVATE! Your 2003 Account Statement for 07808 XXXXXX shows 800 un-redeemed S. I. M. points. Call 08719899217 Identifier Code: 41685 Expires 07/11/04,spam,low
URGENT! We are trying to contact you. Last weekends draw shows that you have won a £900 prize GUARANTEED. Call 09061701939. Claim code S89. Valid 12hrs only,spam,low
U have a Secret Admirer who is looking 2 make contact with U-find out who they R*reveal who thinks UR so special-call on 09065171142-stopsms-08718727870150ppm,spam,low
"Get 3 Lions England tone, reply lionm 4 mono or lionp 4 poly. 4 more go 2 www.ringtones.co.uk, the original n best. Tones 3GBP network operator rates apply.",spam,low
Camera - You are awarded a SiPix Digital Camera! call 09061221066 fromm landline. Delivery within 28 days,spam,low
FreeMsg: Hey - I'm Buffy. 25 and love to satisfy men. Home alone feeling randy. Reply 2 C my PIX! QlynnBV Help08700621170150p a msg Send stop to stop txts,spam,low
Congratulations ur awarded either £500 of CD gift vouchers & Free entry 2 our £100 weekly draw txt MUSIC to 87066 TnCs www.Ldew.com1win150ppmx3age16,spam,low
"Free entry to the gr8prizes wkly comp 4 a chance to win the latest Nokia 8800, PSP or £250 cash every wk.TXT GREAT to 80878 http//www.gr8prizes.com 08715705022",spam,low
FREEMSG: Our records indicate you may be entitled to 3750 pounds for the Accident you had. To claim for free reply with YES to this msg. To opt out text STOP,spam,low
"For ur chance to win a £250 cash every wk TXT: ACTION to 80608. T's&C's www.movietrivia.tv custcare 08712405022, 1x150p/wk.",spam,low
Gr8 new service - live sex video chat on your mob - see the sexiest dirtiest girls live on ur phone - 4 details text horny to 89070 to cancel send STOP to 89070,spam,low
"FREE2DAY sexy St George's Day pic of Jordan!Txt PIC to 89080 dont miss out, then every wk a saucy celeb!4 more pics c PocketBabe.co.uk 0870241182716 £3/wk",spam,low
Please call our customer service representative on FREEPHONE 0808 145 4742 between 9am-11pm as you have WON a guaranteed £1000 cash or £5000 prize!,spam,low
"This is the 2nd time we have tried 2 contact u. U have won the 750 Pound prize. 2 claim is easy, call 08712101358 NOW! Only 10p per min. BT-national-rate",spam,low
Knock Knock Txt whose there to 80082 to enter r weekly draw 4 a £250 gift voucher 4 a store of yr choice. T&Cs www.tkls.com age16 to stoptxtstop£1.50/week,spam,low
"For ur chance to win a £250 wkly shopping spree TXT: SHOP to 80878. T's&C's www.txt-2-shop.com custcare 08715705022, 1x150p/wk",spam,low
Natalja (25/F) is inviting you to be her friend. Reply YES-440 or NO-440 See her: www.SMS.ac/u/nat27081980 STOP? Send STOP FRND to 62468,spam,low
from www.Applausestore.com MonthlySubscription@50p/msg max6/month T&CsC web age16 2stop txt stop,spam,low
RGENT! This is the 2nd attempt to contact U!U have WON £1250 CALL 09071512433 b4 050703 T&CsBCM4235WC1N3XX. callcost 150ppm mobilesvary. max£7. 50,spam,low
Ringtone Club: Gr8 new polys direct to your mobile every week !,spam,low
Hi 07734396839 IBH Customer Loyalty Offer: The NEW NOKIA6600 Mobile from ONLY £10 at TXTAUCTION!Txt word:START to No:81151 & get Yours Now!4T&,spam,low
Wanna get laid 2nite? Want real Dogging locations sent direct to ur mobile? Join the UK's largest Dogging Network. Txt PARK to 69696 now! Nyt. ec2a. 3lp £1.50/msg,spam,low
Please call our customer service representative on FREEPHONE 0808 145 4742 between 9am-11pm as you have WON a guaranteed £1000 cash or £5000 prize!,spam,low
8007 FREE for 1st week! No1 Nokia tone 4 ur mob every week just txt NOKIA to 8007 Get txting and tell ur mates www.getzed.co.uk POBox 36504 W4 5WQ norm 150p/tone 16+,spam,low
ringtoneking 84484,spam,low
"URGENT. Important information for 02 user. Today is your lucky day! 2 find out why , log onto http://www.urawinner.com there is a fantastic surprise awaiting you !",spam,low
"Thanks for your ringtone order, reference number X29. Your mobile will be charged 4.50. Should your tone not arrive please call customer services 09065989180",spam,low
"Bears Pic Nick, and Tom, Pete and ... Dick. In fact, all types try gay chat with photo upload call 08718730666 (10p/min). 2 stop texts call 08712460324",spam,low
"Thanks for your Ringtone Order, Reference T91. You will be charged GBP 4 per week. You can unsubscribe at anytime by calling customer services on 09057039994",spam,low
"YOU VE WON! Your 4* Costa Del Sol Holiday or £5000 await collection. Call 09050090044 Now toClaim. SAE, TC s, POBox334, Stockport, SK38xh, Cost£1.50/pm, Max10mins",spam,low
Do you want a New Nokia 3510i Colour Phone Delivered Tomorrow? With 200 FREE minutes to any mobile + 100 FREE text + FREE camcorder Reply or Call 8000930705,spam,low
URGENT This is our 2nd attempt to contact U. Your £900 prize from YESTERDAY is still awaiting collection. To claim CALL NOW 09061702893. ACL03530150PM,spam,low
UR awarded a City Break and could WIN a £200 Summer Shopping spree every WK. Txt STORE to 88039.SkilGme.TsCs087147403231Winawk!Age16+£1.50perWKsub,spam,low
"YOU 07801543489 are guaranteed the latests Nokia Phone, a 40GB iPod MP3 player or a £500 prize! Txt word:COLLECT to No:83355! TC-LLC NY-USA 150p/Mt msgrcvd18+",spam,low
"tddnewsletter@emc1.co.uk (More games from TheDailyDraw) Dear Helen, Dozens of Free Games - with great prizesWith..",spam,low
FREE entry into our £250 weekly competition just text the word WIN to 80086 NOW. 18 T&C www.txttowin.co.uk,spam,low
"YOU VE WON! Your 4* Costa Del Sol Holiday or £5000 await collection. Call 09050090044 Now toClaim. SAE, TC s, POBox334, Stockport, SK38xh, Cost£1.50/pm, Max10mins",spam,low
FREE MSG:We billed your mobile number by mistake from shortcode 83332.Please call 08081263000 to have charges refunded.This call will be free from a BT landline,spam,low
Sorry I missed your call let's talk when you have the time. I'm on 07090201529,spam,low
You won't believe it but it's true. It's Incredible Txts! Reply G now to learn truly amazing things that will blow your mind. From O2FWD only 18p/txt,spam,low
Get the official ENGLAND poly ringtone or colour flag on yer mobile for tonights game! Text TONE or FLAG to 84199. Optout txt ENG STOP Box39822 W111WX £1.50,spam,low
Update_Now - 12Mths Half Price Orange line rental: 400mins...Call MobileUpd8 on 08000839402 or call2optout=J5Q,spam,low
New TEXTBUDDY Chat 2 horny guys in ur area 4 just 25p Free 2 receive Search postcode or at gaytextbuddy.com. TXT ONE name to 89693,spam,low
5p 4 alfie Moon's Children in need song on ur mob. Tell ur m8s. Txt Tone charity to 8007 for Nokias or Poly charity for polys: zed 08701417012 profit 2 charity.,spam,low
As one of our registered subscribers u can enter the draw 4 a 100 G.B. gift voucher by replying with ENTER. To unsubscribe text STOP,spam,low
"FREE MESSAGE Activate your 500 FREE Text Messages by replying to this message with the word FREE For terms & conditions, visit www.07781482378.com",spam,low
LIFE has never been this much fun and great until you came in. You made it truly special for me. I won't forget you! enjoy @ one gbp/sms,spam,low
Talk sexy!! Make new friends or fall in love in the worlds most discreet text dating service. Just text VIP to 83110 and see who you could meet.,spam,low
"SMS. ac Blind Date 4U!: Rodds1 is 21/m from Aberdeen, United Kingdom. Check Him out http://img. sms. ac/W/icmb3cktz8r7!-4 no Blind Dates send HIDE",spam,low
"Congrats! 1 year special cinema pass for 2 is yours. call 09061209465 now! C Suprman V, Matrix3, StarWars3, etc all 4 FREE! bx420-ip4-5we. 150pm. Dont miss out!",spam,low
You are awarded a SiPix Digital Camera! call 09061221061 from landline. Delivery within 28days. T Cs Box177. M221BP. 2yr warranty. 150ppm. 16 . p p£3.99,spam,low
Double Mins & Double Txt & 1/2 price Linerental on Latest Orange Bluetooth mobiles. Call MobileUpd8 for the very latest offers. 08000839402 or call2optout/LF56,spam,low
Urgent! Please call 09061743811 from landline. Your ABTA complimentary 4* Tenerife Holiday or £5000 cash await collection SAE T&Cs Box 326 CW25WX 150ppm,spam,low
Call FREEPHONE 0800 542 0578 now!,spam,low
What do U want for Xmas? How about 100 free text messages & a new video phone with half price line rental? Call free now on 0800 0721072 to find out more!,spam,low
"Urgent! call 09066350750 from your landline. Your complimentary 4* Ibiza Holiday or 10,000 cash await collection SAE T&Cs PO BOX 434 SK3 8WP 150 ppm 18+",spam,low
-PLS STOP bootydelious (32/F) is inviting you to be her friend. Reply YES-434 or NO-434 See her: www.SMS.ac/u/bootydelious STOP? Send STOP FRND to 62468,spam,low
Ur TONEXS subscription has been renewed and you have been charged £4.50. You can choose 10 more polys this month. www.clubzed.co.uk *BILLING MSG*,spam,low
U’ve Bin Awarded £50 to Play 4 Instant Cash. Call 08715203028 To Claim. EVERY 9th Player Wins Min £50-£500. OptOut 08718727870,spam,low
PRIVATE! Your 2003 Account Statement for <fone no> shows 800 un-redeemed S. I. M. points. Call 08715203656 Identifier Code: 42049 Expires 26/10/04,spam,low
"Shop till u Drop, IS IT YOU, either 10K, 5K, £500 Cash or £100 Travel voucher, Call now, 09064011000. NTT PO Box CR01327BT fixedline Cost 150ppm mobile vary",spam,low
Congratulations ur awarded either £500 of CD gift vouchers & Free entry 2 our £100 weekly draw txt MUSIC to 87066 TnCs www.Ldew.com 1 win150ppmx3age16,spam,low
"XXXMobileMovieClub: To use your credit, click the WAP link in the next txt message or click here>> http://wap. xxxmobilemovieclub.com?n=QJKGIGHJJGCBL",spam,low
"Someone has contacted our dating service and entered your phone becausethey fancy you! To find out who it is call from a landline 09058098002. PoBox1, W14RG 150p",spam,low
Boltblue tones for 150p Reply POLY# or MONO# eg POLY3 1. Cha Cha Slide 2. Yeah 3. Slow Jamz 6. Toxic 8. Come With Me or STOP 4 more tones txt MORE,spam,low
WOW! The Boys R Back. TAKE THAT 2007 UK Tour. Win VIP Tickets & pre-book with VIP Club. Txt CLUB to 81303. Trackmarque Ltd info@vipclub4u.,spam,low
"FREE2DAY sexy St George's Day pic of Jordan!Txt PIC to 89080 dont miss out, then every wk a saucy celeb!4 more pics c PocketBabe.co.uk 0870241182716 £3/wk",spam,low
"Dear Matthew please call 09063440451 from a landline, your complimentary 4*Lux Tenerife holiday or £1000 CASH await collection. ppm150 SAE T&Cs Box334 SK38XH.",spam,low
